{
  "schema_version": 1,
  "id": "component.heim-pc.nixos-managed-activation",
  "type": "component",
  "parent": "repo.heim-pc",
  "metadata": {
    "purpose": "Logical Bureau coordination scope for the managed Nix build and closure-bound activation lane. Physical write authority remains path-scoped through task execution.grabowski_resources.",
    "canonical_paths": [
      "nixos/deployment/",
      "scripts/managed_nix.py",
      "tests/test_managed_nix.py"
    ],
    "source_task": "HEIM-PC-NIXOS-MIGRATION-V1-T002",
    "does_not_establish": [
      "repository-wide mutation authority",
      "production activation authority",
      "host mutation authority",
      "storage mutation authority",
      "merge authority"
    ]
  }
}
