{
  "schema_version": 1,
  "id": "repo.leitwerk",
  "type": "git-repository",
  "parent": "repo",
  "path": "/home/alex/repos/leitwerk",
  "github_slug": "heimgewebe/leitwerk",
  "grabowski_key": "repo:/home/alex/repos/leitwerk",
  "metadata": {
    "lifecycle": "retired",
    "coordination_only": true,
    "retired_on": "2026-09-18",
    "purpose": "Retain immutable local identity/provenance for coordination and closeout of a physically deleted repository.",
    "does_not_establish": [
      "remote_repository_exists",
      "active_checkout",
      "fleet_membership",
      "task_supply_target",
      "runtime_role",
      "execution_authority"
    ]
  }
}
